{
  "game_id": "mock-v1",
  "session_id": "20261012-101500-ab12",
  "step": 0,
  "state_text": "Lane 1 is blocked by an obstacle 2 units ahead. Lane 2 and 3 are clear. Current speed is normal.",
  "facts": {
    "current_lane": 1,
    "speed": 1.0,
    "obstacles": [
      { "lane": 1, "distance": 2 }
    ]
  },
  "legal_actions": [
    { "id": "move_left", "label": "Move Left", "hint": "Blocked by left wall" },
    { "id": "stay", "label": "Stay in Current Lane", "hint": "Collision in 2 steps" },
    { "id": "move_right", "label": "Move Right", "hint": "Lane 2 is completely clear" }
  ],
  "score": 0,
  "done": false
}
